A1: 排名 | B1: 名称 | C1: merchant | D1: equation | E1: rectangle | F1: 总分
A2: =RANK(F2,F$2:F$44) -> 1 | B2: X503-D06 | C2: 78 | D2: 100 | E2: 22 | F2: 200 | G2: DYX
A3: =RANK(F3,F$2:F$44) -> 1 | B3: X503-C06 | C3: 92 | D3: 86 | E3: 22 | F3: 200 | G3: YMY
A4: =RANK(F4,F$2:F$44) -> 3 | B4: X503-C05 | C4: 66 | D4: 100 | E4: 22 | F4: 188 | G4: LZR
A5: =RANK(F5,F$2:F$44) -> 4 | B5: X503-A04 | C5: 100 | D5: 86 | E5: 0 | F5: 186 | G5: YLX
A6: =RANK(F6,F$2:F$44) -> 5 | B6: X503-C07 | C6: 92 | D6: 86 | E6: 0 | F6: 178 | G6: SXY
A7: =RANK(F7,F$2:F$44) -> 6 | B7: X503-E05 | C7: 66 | D7: 86 | E7: 22 | F7: 174 | G7: ZJP
A8: =RANK(F8,F$2:F$44) -> 7 | B8: X503-D02 | C8: 56 | D8: 100 | E8: 0 | F8: 156 | G8: HY
A9: =RANK(F9,F$2:F$44) -> 8 | B9: X503-A01 | C9: 78 | D9: 53 | E9: 22 | F9: 153 | G9: LSY
A10: =RANK(F10,F$2:F$44) -> 9 | B10: X503-B10 | C10: 66 | D10: 86 | E10: 0 | F10: 152 | G10: CXR
A11: =RANK(F11,F$2:F$44) -> 10 | B11: X503-B07 | C11: 78 | D11: 21 | E11: 47 | F11: 146 | G11: YLS
A12: =RANK(F12,F$2:F$44) -> 11 | B12: X503-D03 | C12: 42 | D12: 100 | E12: 0 | F12: 142 | G12: ZY
A13: =RANK(F13,F$2:F$44) -> 12 | B13: X503-C03 | C13: 66 | D13: 53 | E13: 22 | F13: 141 | G13: HYJ
A14: =RANK(F14,F$2:F$44) -> 13 | B14: X503-A06 | C14: 78 | D14: 21 | E14: 22 | F14: 121 | G14: LZM
A15: =RANK(F15,F$2:F$44) -> 14 | B15: X503-D05 | C15: 66 | D15: 3 | E15: 47 | F15: 116 | G15: PSK
A16: =RANK(F16,F$2:F$44) -> 14 | B16: X503-A09 | C16: 30 | D16: 86 | E16: 0 | F16: 116 | G16: LXJ
A17: =RANK(F17,F$2:F$44) -> 16 | B17: X503-C09 | C17: 92 | D17: 21 | E17: 0 | F17: 113
A18: =RANK(F18,F$2:F$44) -> 17 | B18: X503-E06 | C18: 66 | D18: 21 | E18: 22 | F18: 109
A19: =RANK(F19,F$2:F$44) -> 17 | B19: X503-E04 | C19: 66 | D19: 21 | E19: 22 | F19: 109
A20: =RANK(F20,F$2:F$44) -> 19 | B20: X503-E03 | C20: 8 | D20: 100 | E20: 0 | F20: 108
A21: =RANK(F21,F$2:F$44) -> 20 | B21: X503-B08 | C21: 64 | D21: 21 | E21: 22 | F21: 107
A22: =RANK(F22,F$2:F$44) -> 21 | B22: X503-C08 | C22: 100 | D22: 3 | E22: 0 | F22: 103
A23: =RANK(F23,F$2:F$44) -> 22 | B23: X503-E01 | C23: 66 | D23: 0 | E23: 22 | F23: 88
A24: =RANK(F24,F$2:F$44) -> 23 | B24: X503-F06 | C24: 66 | D24: 21 | E24: 0 | F24: 87
A25: =RANK(F25,F$2:F$44) -> 24 | B25: X503-E07 | C25: 0 | D25: 86 | E25: 0 | F25: 86
A26: =RANK(F26,F$2:F$44) -> 25 | B26: X503-A03 | C26: 58 | D26: 3 | E26: 22 | F26: 83
A27: =RANK(F27,F$2:F$44) -> 26 | B27: X503-C10 | C27: 66 | D27: 3 | E27: 13 | F27: 82
A28: =RANK(F28,F$2:F$44) -> 27 | B28: X503-C01 | C28: 78 | D28: 3 | E28: 0 | F28: 81
A29: =RANK(F29,F$2:F$44) -> 28 | B29: X503-B09 | C29: 70 | D29: 3 | E29: 0 | F29: 73
A30: =RANK(F30,F$2:F$44) -> 28 | B30: X503-B05 | C30: 30 | D30: 21 | E30: 22 | F30: 73
A31: =RANK(F31,F$2:F$44) -> 30 | B31: X503-F07 | C31: 66 | D31: 3 | E31: 0 | F31: 69
A32: =RANK(F32,F$2:F$44) -> 30 | B32: X503-F03 | C32: 66 | D32: 3 | E32: 0 | F32: 69
A33: =RANK(F33,F$2:F$44) -> 30 | B33: X503-A07 | C33: 66 | D33: 3 | E33: 0 | F33: 69
A34: =RANK(F34,F$2:F$44) -> 33 | B34: X503-E02 | C34: 66 | D34: 0 | E34: 0 | F34: 66
A35: =RANK(F35,F$2:F$44) -> 34 | B35: X503-B04 | C35: 30 | D35: 21 | E35: 0 | F35: 51
A36: =RANK(F36,F$2:F$44) -> 34 | B36: X503-B03 | C36: 30 | D36: 21 | E36: 0 | F36: 51
A37: =RANK(F37,F$2:F$44) -> 34 | B37: X503-A05 | C37: 8 | D37: 21 | E37: 22 | F37: 51
A38: =RANK(F38,F$2:F$44) -> 37 | B38: X503-F04 | C38: 0 | D38: 21 | E38: 22 | F38: 43
A39: =RANK(F39,F$2:F$44) -> 38 | B39: X503-G05 | C39: 8 | D39: 21 | E39: 0 | F39: 29
A40: =RANK(F40,F$2:F$44) -> 38 | B40: X503-D01 | C40: 8 | D40: 21 | E40: 0 | F40: 29
A41: =RANK(F41,F$2:F$44) -> 40 | B41: X503-F01 | C41: 0 | D41: 21 | E41: 0 | F41: 21
A42: =RANK(F42,F$2:F$44) -> 40 | B42: X503-C02 | C42: 0 | D42: 21 | E42: 0 | F42: 21
A43: =RANK(F43,F$2:F$44) -> 42 | B43: X503-A08 | C43: 8 | D43: 3 | E43: 0 | F43: 11
A44: =RANK(F44,F$2:F$44) -> 43 | B44: X503-A10 | C44: 0 | D44: 0 | E44: 0 | F44: 0