A1: 排名 | B1: 名称 | C1: league | D1: construct | E1: vegetable | F1: 总分
A2: =RANK(F2,F$2:F$47) -> 1 | B2: X503-D03 | C2: 70 | D2: 100 | E2: 75 | F2: 245
A3: =RANK(F3,F$2:F$47) -> 2 | B3: X503-D02 | C3: 100 | D3: 30 | E3: 100 | F3: 230
A4: =RANK(F4,F$2:F$47) -> 3 | B4: X503-E05 | C4: 100 | D4: 30 | E4: 58 | F4: 188
A5: =RANK(F5,F$2:F$47) -> 4 | B5: X503-E04 | C5: 95 | D5: 30 | E5: 58 | F5: 183
A6: =RANK(F6,F$2:F$47) -> 5 | B6: X503-B04 | C6: 40 | D6: 30 | E6: 100 | F6: 170
A7: =RANK(F7,F$2:F$47) -> 5 | B7: X503-D01 | C7: 82 | D7: 30 | E7: 58 | F7: 170
A8: =RANK(F8,F$2:F$47) -> 7 | B8: X503-A03 | C8: 0 | D8: 100 | E8: 58 | F8: 158
A9: =RANK(F9,F$2:F$47) -> 8 | B9: X503-B03 | C9: 40 | D9: 11 | E9: 100 | F9: 151
A10: =RANK(F10,F$2:F$47) -> 9 | B10: X503-A06 | C10: 20 | D10: 30 | E10: 100 | F10: 150
A11: =RANK(F11,F$2:F$47) -> 9 | B11: X503-C09 | C11: 20 | D11: 30 | E11: 100 | F11: 150
A12: =RANK(F12,F$2:F$47) -> 11 | B12: X503-C03 | C12: 0 | D12: 30 | E12: 100 | F12: 130
A13: =RANK(F13,F$2:F$47) -> 11 | B13: X503-D05 | C13: 0 | D13: 30 | E13: 100 | F13: 130
A14: =RANK(F14,F$2:F$47) -> 13 | B14: X503-D06 | C14: 40 | D14: 30 | E14: 58 | F14: 128
A15: =RANK(F15,F$2:F$47) -> 14 | B15: X503-E03 | C15: 100 | D15: 0 | E15: 23 | F15: 123
A16: =RANK(F16,F$2:F$47) -> 15 | B16: X503-C05 | C16: 8 | D16: 53 | E16: 58 | F16: 119
A17: =RANK(F17,F$2:F$47) -> 16 | B17: X503-C08 | C17: 25 | D17: 30 | E17: 58 | F17: 113
A18: =RANK(F18,F$2:F$47) -> 17 | B18: X503-E02 | C18: 40 | D18: 11 | E18: 58 | F18: 109
A19: =RANK(F19,F$2:F$47) -> 18 | B19: X503-C10 | C19: 5 | D19: 0 | E19: 100 | F19: 105
A20: =RANK(F20,F$2:F$47) -> 19 | B20: X503-B08 | C20: 2 | D20: 0 | E20: 100 | F20: 102
A21: =RANK(F21,F$2:F$47) -> 20 | B21: X503-A07 | C21: 7 | D21: 30 | E21: 58 | F21: 95
A22: =RANK(F22,F$2:F$47) -> 21 | B22: X503-B10 | C22: 21 | D22: 30 | E22: 43 | F22: 94
A23: =RANK(F23,F$2:F$47) -> 22 | B23: X503-F06 | C23: 0 | D23: 30 | E23: 58 | F23: 88
A24: =RANK(F24,F$2:F$47) -> 22 | B24: X503-F07 | C24: 0 | D24: 30 | E24: 58 | F24: 88
A25: =RANK(F25,F$2:F$47) -> 24 | B25: X503-E01 | C25: 20 | D25: 0 | E25: 58 | F25: 78
A26: =RANK(F26,F$2:F$47) -> 25 | B26: X503-A08 | C26: 0 | D26: 30 | E26: 38 | F26: 68
A27: =RANK(F27,F$2:F$47) -> 26 | B27: X503-A04 | C27: 8 | D27: 0 | E27: 58 | F27: 66
A28: =RANK(F28,F$2:F$47) -> 27 | B28: X503-E06 | C28: 4 | D28: 0 | E28: 58 | F28: 62
A29: =RANK(F29,F$2:F$47) -> 28 | B29: X503-A10 | C29: 0 | D29: 0 | E29: 58 | F29: 58
A30: =RANK(F30,F$2:F$47) -> 28 | B30: X503-B02 | C30: 0 | D30: 0 | E30: 58 | F30: 58
A31: =RANK(F31,F$2:F$47) -> 28 | B31: X503-C06 | C31: 0 | D31: 0 | E31: 58 | F31: 58
A32: =RANK(F32,F$2:F$47) -> 28 | B32: X503-F03 | C32: 20 | D32: 0 | E32: 38 | F32: 58
A33: =RANK(F33,F$2:F$47) -> 32 | B33: X503-A05 | C33: 7 | D33: 30 | E33: 20 | F33: 57
A34: =RANK(F34,F$2:F$47) -> 32 | B34: X503-A09 | C34: 4 | D34: 30 | E34: 23 | F34: 57
A35: =RANK(F35,F$2:F$47) -> 32 | B35: X503-B05 | C35: 8 | D35: 11 | E35: 38 | F35: 57
A36: =RANK(F36,F$2:F$47) -> 35 | B36: X503-C01 | C36: 0 | D36: 11 | E36: 43 | F36: 54
A37: =RANK(F37,F$2:F$47) -> 36 | B37: X503-F04 | C37: 0 | D37: 30 | E37: 23 | F37: 53
A38: =RANK(F38,F$2:F$47) -> 37 | B38: X503-C07 | C38: 1 | D38: 30 | E38: 20 | F38: 51
A39: =RANK(F39,F$2:F$47) -> 38 | B39: X503-B06 | C39: 0 | D39: 11 | E39: 38 | F39: 49
A40: =RANK(F40,F$2:F$47) -> 38 | B40: X503-F01 | C40: 0 | D40: 11 | E40: 38 | F40: 49
A41: =RANK(F41,F$2:F$47) -> 40 | B41: X503-B07 | C41: 6 | D41: 0 | E41: 38 | F41: 44
A42: =RANK(F42,F$2:F$47) -> 41 | B42: X503-F05 | C42: 0 | D42: 30 | E42: 0 | F42: 30
A43: =RANK(F43,F$2:F$47) -> 42 | B43: X503-A01 | C43: 0 | D43: 0 | E43: 23 | F43: 23
A44: =RANK(F44,F$2:F$47) -> 43 | B44: X503-B09 | C44: 0 | D44: 0 | E44: 20 | F44: 20
A45: =RANK(F45,F$2:F$47) -> 44 | B45: X503-C02 | C45: 0 | D45: 0 | E45: 0 | F45: 0
A46: =RANK(F46,F$2:F$47) -> 44 | B46: X503-E07 | C46: 0 | D46: 0 | E46: 0 | F46: 0
A47: =RANK(F47,F$2:F$47) -> 44 | B47: X503-F02 | C47: 0 | D47: 0 | E47: 0 | F47: 0